{
  "name": "standard",
  "description": "Balanced mode, uses mid-tier models, full review cycle",
  "agent_routing": {
    "planning": "architect",
    "implementation": "executor",
    "code_review": "reviewer",
    "security_review": "security",
    "tests": "test-writer",
    "quality_gate": "quality-gate",
    "completion_guard": "completion-guard",
    "performance": "perf-reviewer",
    "codebase_analysis": "codebase-analyzer",
    "documentation": "doc-writer",
    "e2e_exploration": "e2e-explorer",
    "e2e_generation": "e2e-generator",
    "e2e_validation": "e2e-reviewer"
  },
  "model_tiers": {
    "forbidden": []
  },
  "settings": {
    "max_review_iterations": 3,
    "max_security_iterations": 2,
    "max_quality_gate_iterations": 3,
    "max_completion_guard_iterations": 3,
    "parallel_execution": false,
    "test_required": true
  }
}
